### ISSUE TITLE
mdns multicast-storm

### ISSUE THREAD

**Issue by xuxbuptisc** [micro/mdns#10]
it seems that the default mdns registry made multicast-storm on my lan. am i doing something wrong?

18:03:47.097299 IP x5-devhigh02-dev.i.nease.net.34902 > 224.0.0.251.mdns: 34373 PTR (QM)? jenkins (3)._jenkins._tcp.local. (49)
18:03:47.097324 IP x5-devhigh02-dev.i.nease.net.34902 > 224.0.0.251.mdns: 21506 PTR (QM)? jenkins (3)._jenkins._tcp.local. (49)
18:03:47.097349 IP x5-devhigh02-dev.i.nease.net.35976 > 224.0.0.251.mdns: 53757 PTR (QM)? jenkins (3)._jenkins._tcp.local. (49)

**Comment by asim** [comment]
It's most likely something on your network is spamming. We wouldn't register Jenkins records. Is there anything else using mdns on your network?

**Comment by xuxbuptisc** [comment]
> It's most likely something on your network is spamming. We wouldn't register Jenkins records. Is there anything else using mdns on your network?

i don't think so.
and after i kill the go-micro example process, the network is ok again.
i cannot find jenkins related content in go-micro neither. that is weird.
i cannot reproduce this now, because my lan has security consern. maybe i will do this later and check it again.

**Comment by vtolstov** [comment]
https://wiki.jenkins.io/display/JENKINS/Auto-discovering+Jenkins+on+the+network
i think that you have jenkins in you network

**Comment by vtolstov** [comment]
@asim i think that this can be closed. also i think that if you kill go-micro app, multicast sent too. 
check wireshark output for multicast
